{
  "schemaVersion": 1,
  "protectedBranches": [
    "main",
    "master"
  ],
  "commands": {
    "test": "node --test sum.test.mjs",
    "lint": null,
    "typecheck": null,
    "build": null,
    "e2e": null,
    "sast": null,
    "audit": null,
    "structure": null
  },
  "requiredChecks": [
    "test"
  ],
  "ci": {
    "requiredChecks": []
  },
  "paths": {
    "api": [],
    "e2e": [],
    "infrastructure": []
  },
  "capabilities": {
    "dependencies": false,
    "performance": false,
    "accessibility": false,
    "seo": false
  },
  "documents": {
    "architecture": null,
    "technology": null,
    "taskLedger": "docs/TASKS.md"
  },
  "independentReview": true,
  "cadenceBaseline": 0
}
